line_number,'mra', 'fuzz_partial', 'levin',transcribed_text,source_text
02487,2,97,32,de o petrusu ai demo duru widobuturungu bato kouwa hokoge enanguwa ngaro ngohi de ngona homahidohonenge ma katomodeke ngohi duru kotoniolukuwa de hokoge enangoli o petrusu ai dodiawo utuoli ona ma tamata yokokitemo o yesusika de manga demo gea imakadaenehoka o peturusoli ai demo empenyutunnnn 08,de o peturusu ai demo duru widobuturungu wato koua hokogenangua ngaro ngohi de ngona homahidohonenge ma ka tomodeke ngohi duru ko toniolukua de hokogenangoli o peturusu ai dodiawo utuoli ona mata mata yokokitemo o yesusika de manga demo gea imakadaene hoka o peturusoli ai demo
02493,0,97,9,de wotemohi ma joie bato ahi baba ngohi tohioriki de ngona koiwamoi la koidadiuwa ho togahoko la ahi huha ngohioka nagorakoka ma sara iti ufa to ngohi ahi mau naniiki ma sara tato ngona dika baba ani mau naniiki,de wotemohi ma jouiye wato ahi baba ngohi tohioriki de ngona ko iwa moi la ko idadiua ho togahoko la ahi huha ngohioka nagorakoka masara iti ufa to ngohi ahi mau naniiki masara tato ngona dika baba ani mau naniiki
02478,0,97,8,yokokiokere ibooto deahao wotemonangika wato ma angguru gea ma jou ai behehongo ma do dunguu abe gea to ngohi ahiawunu abeahao ikopoauku la o nyawa manga ngoe manga utumu amake ge enangino,yokokiokere ibooto de ahao wotemo onangika wato ma angguru gea ma jou ai behehongo ma dodunguu abe gea to ngohi ahi awunu abe ahao ikopoauku la o nyawa manga ngoe manga utumu amake genangino
02445,0,98,7,de gee imaketerohoka o tau ma dutu womatengo abe wato woikohi ma gurutika ma oraha itigioka wosobo de ai hu huloko wahitagongoho konaa de hokonaa ma karajaanga de una ma ngorana wotoba goa goana unangika wihuloko wato nohidodiai nogoana,de gea imaketero hoka o tau ma dutu womatengo abe wato woikohi ma gurutika ma oraha itigioka wosobo de ai huhuloko wahitagongo hokonaa de hokonaa ma karajaanga de una ma ngorana wotobagoa goana unangika wihuloko wato nohidodiai noogoana
01940,0,99,4,hokogea o yesusu wadotoko nyawaika abe duru kohangoe o hiketero wapake de gea o nyawa wadotoko hiadono o nyawa manga hininga duru ao mangoka de ai demo ho nako nagahi to ona manga hiakunu la yoihene gea o yesusu kawadotokohi onangika,hokogea o yesusu wadotoko o nyawaika abe duru kohangoe o hiketero wapake de gea o nyawa wadotoko hiadono o nyawa manga hininga duru aomangoka de ai demo ho nako nagahi to ona manga hiakunu la yoihene gea o yesusu ka wadotokohi onangika
02316,0,97,9,abe nata gou goungu tinihingahu o nagona dika duru iwingaku ma jouika abe manga ngo ngaku koidomo domouwa ona gea manga go gahoko okia dika de gea ma jou wahidoaka onangika,abe naa tagou goungu tinihingahu onagona dika duru iwingaku ma jouika abe manga ngongaku ko idomo domoua ona gea manga gogahoko o kia dika de gea ma jou wahidoaka onangika
02450,0,98,4,de ipahaino de ahao naga o wange hinotohi de naga ma oraha be o yahudi ma nyawa ihirame rame manga rame rame hinoto abe moi o totilakuru ma rame rame de moioli abe ihiromanga o roti abe koiwa ma ragi ma rame rame,de ipahaino de ahao naga o wange hinootohi de naga ma oraha abe o yahudi ma nyawa ihirame rame manga rame rame hinooto abe moi o totilakuru ma rame rame de moioli abe ihiromanga o roti abe ko iwa ma ragi ma rame rame
02302,3,96,23,ho una wohikoboto ma gotaika gea bato ibotohi ihofoko ho komoiokauwa yomalee ani hofokinonaa de ona winiiniiki yoihene ai koboto ma demo gea em pnenyunn 08,ho una wohikoboto ma gotaika gea wato ibootohi ihofoko ho ko moiokaua yomale ani hofokino naa de ona iwinii niiki yoihene ai koboto ma demo gea
02582,0,97,8,de o ngo ngofekao yaamuruono naga ge enangoka ma hatoli yokurutika de iwilega lega o yesusu ma oraha gea ibiho honenge de naga manga doomuoka gee o ngo maria madalena de naga o ngo maria abe to yakobusu ai do dipokouku de to yosese manga meme de momatengoli naga o ngo salome,de o ngo ngofekaoo yamuruono naga genangoka ma hatoli yokurutika de iwilega lega o yesusu ma oraha gea iwihohonenge de naga manga doomuoka gea o ngo maria madalena de naga o ngo maria abe to yakobusu ai dodipokouku de to yosese manga meme de momatengoli naga o ngo salome
02555,3,98,24,de gee o pilatusu waputuhoka la wato wahisanangi ai kokawahaika ho wadomoteke dika ho wihihupu o barabasa onangika de wahuloko ho o yesusu iwihipoha pohakahi de o ho honenge ma bo boha de ahao wahigunoa la iwihidapaku o gota isosaliwoaika emmpeyuyutntntn 08,de gea o pilatusu waputuhoka la wato wahisanangi ai kokawaahaika ho wadomoteke dika ho wihihupu o barabasa onangika de wahuloko ho o yesusu iwihipoha pohakahi de o hohonenge ma boboha de ahao wahigunoa la iwihidapaku o gota isosalioaika
02141,0,96,13,ho o yesusu ai demo ma titi gee duru wahitararono onangika la duru ihioriki ho kokia ahaow idadi unangika ma sara o petrusu woboa unangino de kawihirehenika ma ho hutulu de witaaere o yesusika wato ahi baluhu duru koitiaiuwa ma datoro geea idadi ngonaika,ho o yesusu ai demo ma titi gea duru wahitararono onangika la duru ihioriki hokokia ahao idadi unangika masara o peturusu woboa unangino de ka wihirehenika ma hohutulu de witaere o yesusika wato ahi baluhu duru ko itiaiau ma datoro gea idadi ngonaika
02541,1,99,2,de iwihiadonika o pilatusoka de yahao o pilatusu wileha o yesusika wato sarakia ngona naa igoungu o yahudioka manga koano de wipaluhu wato abe ngona ma hirete nohihiromanga okogea,de iwihiadonika o pilatusoka de ahao o pilatusu wileha o yesusika wato sarakia ngona naa igoungu o yahudioka manga koano de wipaluhu wato abe ngona ma hirete nohihiromanga hokogea
02213,6,50,30,maruku pasala ngimoi em enyn 08,10
02569,0,98,7,de dakea o gota isosaliwainoka naga atulihika o hingahu ma demo de tanu ma demoino de yahingahu manga howono okia naga la hiadono ato yaho honenge ma sarato o yesusu itemo ato o yahudi ma nyawa manga koano,de dakea o gota isosalioainoka naga atulihika o hingahu ma demo de tanu ma demoino de yahingahu manga howono o kia naga la hiadono ato yahohonenge masara to yesusu itemo ato o yahudi ma nyawa manga koano
01844,0,96,16,de ahaoma moioli wohiketero o yesusu la wahitararono ma titi okia iadono ona iwininiki koyopuahauwahi abe una wotemo wato nako naga nanga baju ma de kaniino biaha hapake pake de ikakihoka hohato hatapa nako ma da dapa gee ka ma hungiohi gee koidadiuwa de hohiduguriti,de ahao ma moioli wohiketero o yesusu la wahitararono ma titi o kia hiadono ona iwinii niiki ko yopuahauahi abe una wotemo wato nako naga nanga baju ma dekanino biaha hapake pake de ikakihoka ho hato hatapa nako ma dadapa gea ka ma hungiohi gea ko idadiua de hohiduguriti
01850,0,97,8,de o farisi ma nyawa iwitaere o yesusika ato abeika o nagea ado doaho o hiaini ma wangeoka de aatilakuru to ngone nanga pareta anga moi o hiaini ma wangeoka de koidadiuwa hokarajaanga,de o farisi ma nyawa iwitaere o yesusika ato abeika ona gea adodoa ho o hiaini ma wangeoka de atilakuru to ngone nanga pareta angamoi o hiaini ma wangeoka de ko idadiua hokarajaanga
01851,6,98,14,de o yesusu wopaluhu o nangika wato mode ngini koniabasauwahi o dautu ai ade  ade ma jou ai bukuoka abe ma dihira ma oraha o dautu gea de naga womatengo o abiatara abe wodadi to ona manga hidemo wokokurutie ma jouie,25 26 de o yesusu wapaluhu onangika wato mode ngini ko nibasauahi o dautu ai ade ade ma jou ai bukuoka abe ma dihira ma oraha o dautu gea de naga womatengo o abiatara abe wodadi to ona manga hidemo wokokurutiye ma jouiye
01845,0,98,3,nako gee ahao ma da dapa ma hungi ikororomo de atauru ma dabino ho ma baju gea ma moioli ikakihi ma sara ma kakihi ma hungi gea utuohi ilamoko,nako gea ahao ma dadapa ma hungi ikororomo de atauru ma dabino ho ma baju gea ma moioli ikakihi masara ma kakihi ma hungi gea utuohi ilamoko
02568,2,99,2,de ma oraha o yesusu iwihidapaku ahao o takoro hiwo abe o wange koikoronauwahi,de ma oraha o yesusu iwihidapaku ahao o takoro hiwo abe o wange ko ikoronauahi
02140,0,98,13,de kiani ahao ihihikange la ma ngoe ngohino de hiadono ngone o yahudi ma nyawa nanga dimo dimono de ona abe yodadi nanga hidemo ma nyawa ma jou ie manga hidimono de ona abeyo toba doto dotoko o musa ai paretaino ona ma tamata ahao ihikokioluku de gee ihioluku hiadono ahao ihitoma ma sara o wange hangino dika de ka tomomikokali,de kiani ahao ihihikangela ma ngoe ngohino de hiadono ngone o yahudi ma nyawa nanga dimo dimono de ona abe yodadi nanga hidemo ma nyawa ma jouiye manga hohidimono de ona abe yotobadoto dotoko o musa ai paretaino ona mata mata ahao ihikokioluku de gea ihioluku hiadono ahao ihitoma masara o wange hangeino dika de ka tomomikokali
02554,1,98,8,de o pilatusu walehali onangika wato ado doa ho hokogee nihihuloko unangika todiai mode o pareta okia de watilakuru ma sara ai kokawaha kayodogo dogoli yopoa poaka ato niwiho honenge niwihidapakuika dika o gota isosaliwainoka,de o pilatusu walehali onangika wato adodoa ho hokogea nihihuloko unangika todiai mode o pareta o kia de watilakuru masara ai kokawaaha ka yodogo dogoli yopoa poaka ato niwihohonenge niwihidapakuika dika o gota isosalioainoka
02583,3,98,27,o ngofeka yaruange gea ma dihira abe o yesusu wotagi tagi wadoto dotoko o galilea ma tonakoka de ona iwiniiniiki de iwitobaleleani de manga domuoka gea o ngo ngofeka utuoli naga manga ngoe de ona gea yoturuino iwiniiki o yesusu abe yoboa o yerusalemino ho ona ma tamata naga iwilega lega abe ma oraha gea o yesusu iwiho honenge ememp penyutnunn 08,o ngofeka yaruange gea ma dihira abe o yesusu wotagi tagi wadoto dotoko o galilea ma tonakoka de ona iwinii niiki de iwitobaleleani de manga doomuoka gea o ngo ngofeka utuoli naga manga ngoe de ona gea yoturuino iwiniiki o yesusu abe woboa o yerusaleemino ho ona mata mata naga iwilega lega abe ma oraha gea o yesusu iwihohonenge
02451,3,97,27,de ma rame rame gea koimulaenguwahi de ona o hidemo ma nyawa ma jouie manga hidimono de ona ngo abe yotobadoto dotoko musa ai paretaino ona yomakoketemo de gea iwihidee la ato o yesusu yomatohiki abe iwitaoko de iwitoma empemeyutunnnn 08,de ma rame rame gea ko imulaenguahi de ona o hidemo ma nyawa ma jouiye manga hohidimono de onangoo abe yotobadoto dotoko o musa ai paretaino ona yomakoketemo de gea iwihidee la ato o yesusu yomatohiki abe iwitaoko de iwitoma
02317,0,96,10,abe ngaro o nayahuloko lokuika gee ato nomagorakooka de nomahidulutuoka o gahiuku de nako manga hu huloko ma demo yangaku abe aha o idadi gee ahao ma jou o loku gee wagoraka de wahidulutuoka,abe ngaro ona yahuloko o lokuika gea ato nomagorakoka de nomahidulutuoka o gahiuku de nako manga huhuloko ma demo yangaku abe ahao idadi gea ahao ma jou o loku gea wagoraka de wahidulutuoka
01941,3,96,33,de ai do dotoko komoiuwa de kowohiketerouwa duru o hiketerodika wapake ma sarana ko una de iwitobaniiniiki dika naga gee ahao wahitararono onangika abe yohiketero ma titi matamata emp epeyuueunn 208,de ai dodotoko ko moiua de ko wohiketeroua duru o hiketero dika wapake masara nako una de iwitobanii niiki dika naga gea ahao wahitararono onangika abe o hiketero ma titi mata mata
02444,0,94,9,ho kianika ihikaika nimagoana de ufa kainikiokohi o howonika anga moi nginio ma konihiorikuwa ahi gahi gea,ho kiani ka ihikaika nimaagoana de ufa ka inikiookohi o howonika angamoi nginioo ma ko nihiorikua ahi gahe gea
02479,2,97,10,nata gou goungu tinihingahu nama batingi abe o angguru ma gohaka ma teongo gee kotokerokauwahi ma sara aha o abe ma oraha ma jou wahikoano o nyawa gea de ahao ma hungioli tokere,naa tagou goungu tinihingahu naa ma batingi abe o angguru ma gohaka ma teongo gea ko tokerokauahi masara ahao abe ma oraha ma jou wahikoano o nyawa gea de ahao ma hungioli tokere
02492,0,97,4,de o yesusu woiki hatoli watingakika yaruange gea de womamutumuku womaniata ma jouie bato nako kaidadi iti ufa gea ahi kangela abe itigioka idadi ngohino,de o yesusu woiki hatoli watingakika yaruange gea de womamotumuku womaniata ma jouiye wato nako ka idadi iti ufa gea ahi kangela abe itigioka idadi ngohino
02486,0,97,8,de ahaoo yesusu witemo bato ahi dodiawo na tagoungu tonihingahu bootino o futunaa dika abe koitebinuahi de ngona naa nohioluku abe bootino o kuru kuru ataili ahaon ma ahinoto de ngona naa nohioluku ma hangeou,de ahao o yesusu witemo wato ahi dodiawo naa tagoungu tonihingahu bootino o futu naa dika abe ko itebinuahi de ngona naa nohioluku abe bootino o kuru kuru ataili ahao ma hinooto de ngona naa nohioluku ma hangeou
02525,0,96,13,ngini wonihenoka ai demo abe ka a unadika ma hirete de ma jou wi ngelo abe una ka o nyawa biahadika de womahingahu bato ahao wogogere ma jouoka la ona yahinoto ihikoano ma tamataika,nginioo niihenoka ai demo abe ka una dika ma hirete de ma jou wingelo abe una ka o nyawa biaha dika de womahingahu wato ahao wogogere ma jouoka la ona yahinooto ihikoano mata mataika
02048,2,96,14,kade gee ai paha de o yesus waributu iwitobaninikika la ona yofarene o ngotiroko de ona yohira yosobo la ato yomahihora doka o besaida ma kapongika ho ona yosoboka de una wahuloko manga ngoe ngoeika bato ahi gogianongoru ma raenaa kaidadi ngini nikokilio nia kokitauika,ka de gea ipaha de o yesusu waribuutu iwitobanii niikika la ona yofarene o ngotiroko de ona yohira yosobo la ato yomahihora doka o besaida ma kapongika ho ona yosoboka de una wahuloko manga ngoe ngoeika wato ahi gogianongoru marai naa ka idadi ngini nikokilio nia kokitauika
02531,0,97,7,de muna gee o petrusu mimake de duru midamaanoka de hiadono mitemo unangika mato o ma rai ngonao na to una ai dodiawo abe o nazaretoka ma nyawa gee abe iwihiromanga o yesusu,de muna gea o peturusu mimake de duru midamaanoka de hiadono mitemo unangika mato o marai ngonaoo naa to una ai dodiawo abe o nasaretoka ma nyawa gea abe iwihiromanga o yesusu
02519,2,93,8,ma sara ngaro o nangoo ma manga da dae ma demo gee ko imakadaenuwa ho koidadiuwa iwiho howono,masara ngaro onangoo ma manga dadae ma demo gea ko imakadaenua ho ko idadiua iwihohowono
02288,3,96,13,ma saranako o nyawa initaaere ato nihido doa ho manga keledai ma ngofaka gea de niahohe gea de ahao kiani niapaluhu onangika ho konaa niato miabaluhu una wopereluug ma koite dekanuwa de wohigilio ma dingii nonaa,masara nako o nyawa initaere ato nihidodoa ho manga keledai ma ngofaka gea de niahohe gea de ahao kiani niapaluhu onangika hokonaa niato mia baluhu una woperelu ma ko itedekanua de wohigilio ma dingiino naa
02347,0,99,5,de gea duru ma jouoka de aino wodiai de duru inahisanangi de abe duru inahiheranga ho kogea itemo ma jou ai demo demoka ho mode ngini komamoiwahi nibasa ma demo demo gea abeika nimafikirohi ai demo gea ma dumutu o nagunaika,de gea duru ma jouoka de aino wodiai de duru inahisanangi de abe duru inahiheranga hokogea itemo ma jou ai demo demoka ho mode ngini ko ma moiuahi nibasa ma demo demo gea abeika nimafikirohi ai demo gea ma dumutu onagunaika
02353,2,97,7,ma sara o yesusu wahiorikoka naga manga hidee abiahao ato iwikalaki ho una wato ado doa ho ngini nihitaili abeika niaoino moi o tiwi isee seenge la kaidadi tolegahi,masara o yesusu wahiorikoka naga manga hidee abe ahao ato iwikalaki ho una wato adodoa ho ngini nihitaili abeika niaoino moi o tiwi ise senge la ka idadi tolegahi
02384,0,99,4,de waaleha o nyawa yowoe woeika wato ona abe yotoba doto dotoko o musa ai paretaino ona yodotoko ato nanga koano o kristusu abe ma dihira ma jou winihibeheongoka wato ahao wihidingoto nginiuku una gea ka o nyawa biaha dika anga moi wodadi nanga tofora o dautu ai totoforaukuino,de waleha o nyawa yowoe woeika wato ona abe yotobadoto dotoko o musa ai paretaino ona yodotoko ato nanga koano o kristusu abe ma dihira ma jou winihibehehongoka wato ahao wihidingoto nginiuku una gea ka o nyawa biaha dika angamoi wodadi nanga tofora o dautu ai totoforaukuino
02390,3,97,20,nako ngohi gea duru koidadiuwa de o nyawa yowoe woe ge enangoka duru yogarago ma titi o yesusu ai demo gea em m penunnn 08,nako ngohi gea duru ko idadiua de o nyawa yowoe woe genangoka duru yogarago ma titi o yesusu ai demo gea
02386,0,97,11,anga moi yabeika to dautu ma sirete ai demo demo abe ma dihira wohitulihuku wotemo wato ma jou a yawe wotemo ahi baluhu ido dutuika wato naino nogogere ahi nirakoka la ngone hohikoano ma tamataika kahiadono ani musu gee duru manga hingounu naga ngonaika,angamoi abeika to dautu ma hirete ai demo demo abe ma dihira wotulihuku wotemo wato ma jou o yawe wotemo ahi baluhu idodutuika wato naino nogogere ahi nirakoka la ngone hohikoano mata mataika ka hiadono ani musu gea duru manga hingounu naga ngonaika
02392,0,98,12,de o nyawaika wadotoko hiwato nimahidodiai ona abe yotoba doto dotoko o musa ai paretaino ona geaduru yotobasade abe yoigo manga baju ma ro rahai yomahinoauku de yotagi tagi la ato yomahimatoko manga kuaha ikurutie o nyawaika de duru yoigo o nyawa ya hayanga onangika okia ka naga abe o nyawa yowoe woe,de o nyawaika wadotokohi wato nimahidodiai ona abe yotobadoto dotoko o musa ai paretaino ona gea duru yomatobasade abe yoigo manga baju ma rorahai yomahinoauku de yotagi tagi la ato yomahimatoko manga kuaha ikurutiye o nyawaika de duru yoigoo o nyawa yahayanga onangika o kiaka naga abe o nyawa yowoe woe
02379,0,98,5,de genangoli nagoungu nato kiani nanga jou hidora de nanga womaha ma gahumu de kiani hidora de nanga hiningao ma gahumu de kiani hidora unangika de okia dika matamata abe naga ngoneoka de o nyawa utuika hadora imaketero hoka to ngone nanga roehe ma sirete hodora,de genangoli nagoungu nato kiani nanga jou hidora de nanga womaha ma gahumu de kiani hidora de nanga hiningaoo ma gahumu de kiani hidora unangika de o kia dika mata mata abe naga ngoneoka de o nyawa utuika hadora imaketero hoka to ngone nanga roehe ma hirete hoodora
02345,0,98,6,de aha o yesusu wohigila gilahi ai demo nangika wato abe ma titi ona wioluku ma dutu ai ngofaka gee imakiniiki de abe ma dodihiraka naga ihitulihukuoka ma jou ai demo demoka,de ahao o yesusu wohigila gilahi ai demo onangika wato abe ma titi ona iwioluku ma dutu ai ngofaka gea imakiniiki de abe ma dodihiraka naga itulihukuoka ma jou ai demo demoka
01999,2,96,13,ho ai kapongoka gee koiwa manga horomati unangika ho kowodiaiuwa o he heranga bo wahu naga o nyawa yamuruono naga dika yopo panyakeuku waso de ai giama de wahitogumu tanu ai hininga la ka manga ngoe wahitogumu ma sara unangika koiwingakuwa ho koidadiwali,ho ai kapongoka gea ko iwa manga horomati unangika ho ko wodiaiua o heheranga bowahu naga o nyawa yamuruono naga dika yopopanyakeuku waso de ai giama de wahitogumu tanu ai hininga la ko manga ngoe wahitogumu masara unangika ko iwingakua ho ko idadiuali
02351,0,97,9,de ona yoboa o yesusino de iwitemo ato mia guru abe ngona minihiorikoka ngona notoba gou goungu de ngona konairikuwa o nyawa de ma jou ai mau ngoneino nomidotoko duru nagou goungu hogean mi ato ngonaika minileha de ho konaa miale leha,de ona yoboa o yesusino de iwitemo ato mia guru abe ngona minihiorikoka ngona notobagou goungu de ngona ko nairikua o nyawa de ma jou ai mau ngoneino nomidotoko duru nagou goungu ho gea miato ngonaika minileha de hokonaa mia leleha
02527,0,98,8,de ahao yamuruono naga iwiobiri o yesusoko de ai lako apakitoka de o ngoere ma belaka la ufa womahioriki de ahao ona yomakawalimi iwitidingi de aho iwileha ato ei nako ngo nai goungu naga ani so sawaro ma jouoka de aino abeika nomihingahu onagona initidingi na,de ahao yamuruono naga iwiobiri o yesusoko de ai lakoko apakitoka de o ngoere ma belaka la ufa womahioriki de ahao ona yomakawalimi iwitidingi de ahao iwileha ato ei nako ngona igoungu naga ani sosawaro ma jouoka de aino abeika nomihingahu onagona initidingi naa
02533,0,97,6,de ahao o ngofeka gea mimakeokali o petrusu ma ngoranoka de o nangikali abe yomatomuino ge enangoka de mahingahu mato una naa ma raioka to ona manga doomuino,de ahao o ngofeka gea mimakeokali o peturusu ma ngoranoka de onangikali abe yomatoomuino genangoka de mahingahu mato una naa maraioka to ona manga doomuino
02490,0,99,4,de o yesusu wao o petrusu de o yakobusu de o yohanese la yomakiniiki de de una de yomahi adonika dokenangika de o yesusu duru ai hininga ihuha hiadono kowomahimakeokauwa ai hininga,de o yesusu wao o peturusu de o yakobusu de o yohanese la yomakiniiki de de una de yomahiadonika dokenangika de o yesusu duru ai hininga ihuha hiadono ko womahimakeokaua ai hininga
02484,2,97,4,ma sara ahao tomomikoli ahi honengino de gee ahao ngohi toiki tohira o galilea ma tonakika de ngini ahao nihi hido duruino,masara ahao tomomikoli ahi honengino de gea ahao ngohi toiki tohira o galilea ma tonakika de ngini ahao nihihidoduruino
02446,0,97,10,gea duru imaketero ahi behehongo nginika tato ngini niogoa goana anga moi nginio ma konihiorikuwa muruonoka de o tau ma dutu gea woboa ma rai ihmuririhuku de woboa eko ma rai o futu gorona de woboa eko ma rai ngade ngade itebini de woboa eko la ma rai o wange ihiwariha de woboa,gea duru imaketero ahi behehongo nginika tato ngini niogoa goana angamoi nginioo ma ko nihiorikua muruonoka de o tau ma dutu gea woboa marai ihumuririhuku de woboa eko marai o futu gorona de woboa eko marai ngade ngade itebini de woboa ekola marai o wange ihiwariha de woboa
02329,3,97,20,hokogee yaidadi abi o yesusu de o yahudi ma nyawa manga hohidimono yomakoketemo de manga demo o yesusu wahikala abi to ona manga hininga wohikawalimi empeyyutnn 208,hokogea idadi abe o yesusu de o yahudi ma nyawa manga hohidimono yomakoketemo de manga demo o yesusu wahikala abe to ona manga hininga wohikawalimi
02453,2,95,12,ma sara o nautu yomaketehitiari ato uwa una gee hitaoko o rame rame ma gogiriaka done ahao o nyawa ipuda o kangamo hoko gee o yahudi ma nyawa manga hohidimono manga hidee la ato ibitoma o yesusu,masara ona utu yomahiketehitiari ato ufa una gea hitaoko o rame rame ma gogiriaka done ahao o nyawaka ipuda o kangamo hokogea o yahudi ma nyawa manga hohidimono manga hidee la ato iwitoma o yesusu
02301,0,98,5,ho ma gotaika gea wolegahi la wato wamake ma hofoko ma sara wolegaika de ma hokadika naga ma sara moio de koiwa ma hofoko ma gotaka gea,ho ma gotaika gea wolegahi la wato wamake ma hofoko masara wolegaika de ma hoka dika naga masara moioo de ko iwa ma hofoko ma gotaka gea
01943,0,91,13,de o wange gee yaduru o bimaoaka de o yesus wotemo wininikika bato niaino la ngone homahihora doka o ngooto ma honongaika,de o wange gea duru o bobimaowaka de o yesusu watemo iwinii niikika wato niaino la ngone homahihora doka o ngooto ma honongaika
02315,0,92,5,de o yesusu wopaluhu iwininikika bato kiani niwingaku ma jouika,de o yesusu wapaluhu iwinii niikika wato kiani niwingaku ma jouika
02581,0,98,7,de na abe o yesusu ai gota isosaliainoka nagali womatengo abe o roma manga tentara manga baluhu abe ai kokawaha yaratuhu moi ho una ngo naga o yesusu ai gotaka de una wimake o yesusu hokokia wohonenge de wotemo bato duru ikou goungu una gea to ma jou ai ngofaka,de naa abe o yesusu ai gota isosalioainoka nagali womatengo abe o roma manga tentara manga baluhu abe ai kokawaaha yaratuhu moi ho unangoo naga o yesusu ai gotaka de una wimake o yesusu hokokia wohonenge de wotemo wato duru igou goungu una gea to ma jou ai ngofaka
02542,0,98,2,de ahao ohidemo ma nyawa ma jouie manga hohidimono ona duru iwitae tae o yesusika,de ahao o hidemo ma nyawa ma jouiye manga hohidimono ona duru iwitae tae o yesusika
02142,2,97,12,ma sara o yesusu womadogilioro de womalega iwininikika de yahao o petrusikali witaaere wato ngona naa hoka o ibilihidika ma mau naniiki ho ahi poretoko nomahiwalimoka ibootoka notemo hokogea anga moi gee o nyawadika manga hininga naniiki de ko ma jou ai mauwa naniiki nako hokogea notemo,masara o yesusu womadogilioro de womalega iwinii niikika de ahao o peturusikali witaere wato ngona naa hoka o ibilihi dika ma mau naniiki ho ahi poretoko nomahiwalimoka ibootoka notemo hokogea angamoi gea o nyawa dika manga hininga naniiki de ko ma jou ai mauua naniiki nako hokogea notemo
01853,0,94,14,abe tanu o ona manga hidemo ma nyawadika kaidadi ya olomo ma roti geea o nyawa utu duru koidadiuwa ya olomo ma sara o dautu una waolomo de wahikokodokuo ai dodiawoika la ona ngoo yaolomo,abe tanu ona manga hidemo ma nyawa dika ka idadi yaolomo ma roti gea o nyawa utu duru ko idadiua yaolomo masara o dautu una waolomo de wahikodokuoo ai dodiawoika la onangoo yaolomo
02238,0,98,6,de nagali itemo koidadiuwa o nyawa nia rusi rusi de kiani naga nia horomati nia baba de nia memeika hiadono niahingounu de nia ao irahai onangika hokogea o musa ai pareta inahingahu hokogea o yesusu ai bo baluhu unangika,de nagali itemo ko idadiua o nyawa niarusi rusi de kiani naga nia horomati nia baba de nia memeika hiadono niahingounu de niao irahai onangika hokogea o musa ai pareta inahingahu hokogea o yesusu ai bobaluhu unangika
01847,5,96,28,honako mateo ngo mahungi kiani hoguhe o popoje ma hungiuku hokogee o yesusu ai ketero abe genangino de wahitararono ma titi okia naga hiadono to una ai dodiawo koyopuahauwahi ma oraha gea em peyuyututut 08,ho nako ma teongo ma hungi kiani hoguhe o popoje ma hungiuku hokogea o yesusu ai hiketero abe genangino de wahitararono ma titi o kia naga hiadono to una ai dodiawo ko yopuahauahi ma oraha gea
01846,0,97,12,de ma moioli o yesusu wohiketero abe ma titi ka moi de hokonaa kangano bato nako naga o angguru ma teongo ka ma hungiohi koidadiu aho guhe o po pojeuku nako ma popoje ma dekanoka done ahao ma teongo ihaga de ma popoje ipotoka de gee ahao ma teongo ikopoaka de ma popojeo iirusakoka,de ma moioli o yesusu wohiketero abe ma titi ka moi de hoka kangano wato nako naga o angguru ma teongo ka ma hungiohi ko idadiua hoguhe o popojeuku nako ma popoje ma dekanoka done ahao ma teongo ihaga de ma popoje ipotoka de gea ahao ma teongo ikopoaka de ma popojeoo irusakoka
02239,0,98,5,de una womahingahu o yesusika wato ia ahi guru anga moi ngohi o pareta gee mata mata ngohi naa duru tanikoka ahi ete tekinohi,de una womahingahu o yesusika wato iya ahi guru angamoi ngohi o pareta gea mata mata ngohi naa duru taniikoka ahi etetekinohi
