line_number,'mra', 'fuzz_partial', 'levin',transcribed_text,source_text
01811,0,98,3,de kiani nomahihuba o hu huba duuru imaketero hoka o musa wosiparetaka la gea nomahitunguu abe duru notogumoka hokogea o yesusu wihibehehongo unangika,de kiani nomahihuba o huhuba duru imaketero hoka o musa wohiparetaka la gea nomahitunguu abe duru notogumoka hokogea o yesusu wihibehehongo unangika
02122,3,98,4,de ai demo gea yoihene ma kohiorikuwa ho yomakoketemo ato bote ai demo gea ma titi ma roti abe ko homagaouwa,de ai demo gea yoihene ma ko ihiorikua ho yomakoketemo ato bote ai demo gea ma titi ma roti abe ko homagaoua
02264,0,98,13,ona ato ma rai mimagahoko miato abeahao ma oraha o nyawa nahi koano kiani ngomio miahi koano de de ngona de ma oraha o nyawa inihigiriri de nogogeruku ani pareta ma kaderaka de o nyawa nahi koano de ngomio miato migogeruku ani arigumurukoka la to ngomio miakuaha naga de moi ani nirakoka migogere de moi ani gubadioka migogere,ona ato marai mimagahoko miato abe ahao ma oraha o nyawa nahikoano kiani ngomioo mikoano de de ngona de ma oraha o nyawa inihigiriiri de nogogeruku ani pareta ma kaderaka de o nyawa nahikoano de ngomioo miato migogeruku ani arigumurukoka la to ngomioo mia kuaha naga de moi ani nirakoka migogere de moi ani gubadioka migogere
02136,0,94,13,de o yesusu walehali wininikika bato ma sara nako ngini niatobote ngohenaa o naguna de o petrusu wipaluhu o yesusika bato ngona gee o mesia mia koano abe ma dihira ma jou womihibehehongoka,de o yesusu walehali iwinii niikika wato masara nako ngini niato bote ngohi naa onaguna de o peturusu wipaluhu o yesusika wato ngona gea o mesia mia koano abe ma dihira ma jou womihibehehongoka
02270,0,98,10,abe manga kokoano de manga balu baluho duru yoigo yahipareta de duru yoigo yahuloko hokonaa de hokonaa manga kokawahaika ma sara ngini na uwa nia hiningaka nimaduru abehoka onangoli manga hininga abe nginioka o nagona dika niato nia dodiawo inihoromati nginika gea kiani niatobaleleani ona ngika gea,abe manga kokoanoo de manga balu baluhoo duru yoigo yahipareta de duru yoigo yahuloko hokonaa de hokonaa manga kokawaahaika masara ngini naa ufa nia hiningaka nimaaduru abe hoka onangoli manga hininga abe nginioka onagona dika niato nia dodiawo inihoromati nginika gea kiani niatobaleleani onangika gea
02258,0,96,11,o ngekomo madatekoka de womahingahu wininikika bato naa hodoa o yerusalemie de o wange muruonohi ipahaikali de hao ge enangoka ngohi ihibodito abe ngohi o nyawa ma ngofaka ihihidoaka ngone o yahudi ma nyawa nanga hohidimonika,o ngekomo ma datekoka de womahingahu iwinii niikika wato naa hodoa o yerusaleemiye de o wange muruonohi ipahaikali de ahao genangoka ngohi ihibodito abe ngohi o nyawa ma ngofaka ihihidoaka ngone o yahudi ma nyawa nanga hohidimonika
01827,3,97,24,de una wolugu lugu kadau de womahiburarahie de ai nanao wagoraka de wohupu manga himangoka de waika de o nyawa manga ngoe ge enangoka duru yokokiheranga hiadono ma jou iwihigiriri de yokokitemo ato ko ma moiwahi ma datoro abe hokonaa ngone hamake emenyuttn 08,de una wolugu lugu ka dau de womahiburahiye de ai nanao wagoraka de wohupu manga himangoka de waika de o nyawa manga ngoe genangoka duru yokokiheranga hiadono ma jou iwihigiriiri de yomakoketemo ato ko ma moiuahi ma datoro abe hokonaa ngone hamake
02073,5,97,13,ma sara ngini nihikawalimi ai demo gea abe ninadotoko ngoneino niato o pareta musaino gea ngaro kohohingounuwa haniiki ma sara kowado doauwa ngini ninadotoko niato kaidadi hotemo nanga baba de nanga memeika hokonaa hato ya ahi baba de ngohi meme tomahiloaee,masara ngini nihikawalimi ai demo gea abe ninadotoko ngoneino niato o pareta o musaino gea ngaro ko hohingounua haniiki masara ko adodoaua ngini ninadotoko niato ka idadi hotemo nanga baba de nanga memeika hokonaa hato iya ahi baba de ngohi meme tomahilooa e
02067,0,96,7,de o yesusu wopalu honangika wato naga moi ma jou ai demo abe atolihuku ma do diheraino abe winihitaana ngini naa,de o yesusu wapaluhu onangika wato naga moi ma jou ai demo abe atulihuku ma dodihiraino abe winihitaana ngini naa
01833,0,99,3,de nagali genangoka o farisi manga doomuino ma nyawa de ona abe yotoba doto dotoko o musa ai paretaino hoka de ona geea iwimake o yesusu wolomo de ona o pajaka yogaho gahoko de abe yodiaioka itorou,de nagali genangoka o farisi manga doomuino ma nyawa de ona abe yotobadoto dotoko o musa ai paretaino ho ka de ona gea iwimake o yesusu wolomo de ona o pajaka yogaho gahoko de abe yodiaioka itorou
02066,0,97,13,ho gee ma titi hiadono o farisi ma nyawa de ona abe yotoba doto dotoko o musa ai paretaino gee yoboaino yesusino de iwileha unangika yato ado doa ho ini niiniiki ko anikua nanga pareta nanga baluhino ho hiadono yolomo de koyomaihorikauwa abehoka nanga balu baluhino ina dotokoka,ho gea ma titi hiadono o farisi ma nyawa de ona abe yotobadoto dotoko o musa ai paretaino gea yoboaino o yesusino de iwileha unangika yato adodoa ho ininii niiki ko aniikua nanga pareta nanga baluhino ho hiadono yolomo de ko yomaihorikaua abe hoka nanga balu baluhino inadotokoka
01832,0,97,14,de aha o yesusu de winiiniiki naga o lewi ai tauoka yomatomuino yolomo ai tau ma goronaka gea de naga utu manga ngoe iwiniiki o yesusu abe manga datoro ito torou ho ma oraha gea naga abe wopajaka yogaho gahoko de nagali utu abe yodiaioka itorou ma jouika ona ma tamata gea yolomo hoimoi ge enangoka o lewi ai tauoka,de ahao o yesusu de iwinii niiki naga o lewi ai tauoka yomakutuono yolomo ai tau ma goronaka gea de naga utu manga ngoe iwiniiki o yesusu abe manga datoro itotorou ho ma oraha gea naga abe o pajaka yogaho gahoko de nagali utu abe yodiaioka itorou ma jouika ona mata mata gea yolomo hoimoi genangoka o lewi ai tauoka
01826,0,97,9,de gea itaana nako tihuloko la womomiki de una kaidadi womaloiki hogea o yesus wotemo ona ngii kaibooto de ahao wolugu luguikali wotemoli wato honaa ngonaika tonihuloko la ngona nomomikoka de ani nanao nagoraka de kaidadi nolio ani tauika,de gea itaana nako tihuloko la womomiki de una ka idadi womaloiki ho gea o yesusu wotemo onangika ibooto de ahao wolugu luguikali wotemoli wato ho naa ngonaika tonihuloko la ngona nomomikoka de ani nanao nagoraka de ka idadi nolio ani tauika
02259,0,97,13,ihihidoa ka onangika abe ohidemo ma nyawa ma jou ie manga hohidimonika de o nangikao abe yotoba doto dotoko o musa ai paretaino de ihiiaoika de ona aputuhu ahao ato ihiho honenge de ihiurusu ibooto deahao ihi hidingotoli o po paretaika abe ko o yahudi ma nyawauwa,ihihidoaka onangika abe o hidemo ma nyawa ma jouiye manga hohidimonika de onangikaoo abe yotobadoto dotoko o musa ai paretaino de ihiaoika de ona aputuhu ahao ato ihihohonenge de ihiurusu ibooto de ahao ihihidingotoli o poparetaika abe ko o yahudi ma nyawaua
02072,0,97,9,abe ma titi ngini hokonaa nidiai ma dihirainohi de o musa wotemoka bato nia baba de niameme kiani niaao irahai de wotemoli bato o nagona dika abe yongelo manga ba baika eko manga memeika de manga demo ma dorou ona gee kiani yohonenge de manga ho howono gea itiai hokogea ma jou ai pareta,abe ma titi ngini hokonaa nidiai ma dihirainohi de o musa wotemoka wato nia baba de nia meme kiani niao irahai de wotemoli wato onagona dika abe yangelo manga babaika eko manga memeika de manga demo ma dorou ona gea kiani yohonenge de manga hohowono gea itiai hokogea ma jou ai pareta
02271,0,97,7,de hokoge enango ngini abe niato nginiohi nimahikurutie ma jou ai himangoka de gea kiani nidadi nia dodiabo ma tamata manga gilaongo,de hokogenangoo ngini abe niato nginiohi nimahikurutiye ma jou ai himangoka de gea kiani nidadi nia dodiawo mata mata manga gilaongo
02137,3,96,18,de aha o yesusu duru wahitiari o nangika bato uwa o nyawaika niahingahu ma demo gea em peyuutu 08,de ahao o yesusu duru wahitiari onangika wato ufa o nyawaika niahingahu ma demo gea
02265,0,97,15,de watemo nangika bato ngini duru konihiorikuwahi abe nimagahokoka abe ngini niato nihidodiawo ma oraha o nyawaika tahikoano ma sara abe ma oraha ahi kokange la tohimanga sarakia ma oraha ge enango kaidadi niapoa nihidodiawo de ma ho hangihara abe hao ahi hininga ihidulungunu gee nginio kaidadi niakunu hokogea,de watemo onangika wato ngini duru ko nihiorikuahi abe nimagahokoka abe ngini niato nihidodiawo ma oraha o nyawaika tahikoano masara abe ma oraha ahi kokangela tohimanga sarakia ma oraha genangoo ka idadi niapoa nihidodiawo de ma hohangihara abe ahao ahi hininga ihidulungunu gea nginioo ka idadi niakunu hokogea
02537,6,0,44,maruku pasa la ngimoi de motoa e ppnnun 7 08,15
02123,4,94,27,de ona yomakoketemo gee yau yesus wohioriki howataaero nangika wato ado doa ho nimakoketemo abe ma titi nia roti koiwa bote niaataoko ihowono gee totemoka mode konihingakuwa abe taahiolomo o nau nauru yasana motoa de o roti motoadika,17 21 de ona yomakoketemo gea o yesusu wohioriki ho wataere onangika wato adodoa ho nimakoketemo abe ma titi nia roti ko iwa bote niataoko ihowono gea totemoka mode ko niohiningakaua abe tahiolomo o nau nauru yasana motoa de o roti motoa dika
01810,0,98,6,de kowosobouwahi de o yesusu duru wihibehehongo bato abe naa idadioka ngonaika ufa nahingahu ngahu o nyawa utuika ma noikoohi unangika abe nia idemo ma jouie la nomahimatoko unangika la gea wohioriki abe ngona notogumoka,de ko wosobouahi de o yesusu duru wihibehehongo wato abe naa idadioka ngonaika ufa nahingahu ngahu o nyawa utuika ma noikohi unangika abe nia hidemo ma jouiye la nomahimatoko unangika la gea wohioriki abe ngona notogumoka
01804,3,99,15,de o yesusu wotagi tagi o galilea ma tonaka ma mukika de o nyawa wadotoko manga do dotoko ma tau tauoka de manga toka tokata ma dorou wakokititokoka epnyut 2008,de o yesusu wotagi tagi o galilea ma tonaka ma amokika de o nyawa wadotoko manga dodotoko ma tau tauoka de manga toka tokata ma dorou wakokititokoka
02099,0,99,6,de o yesusu o nyawa manga ngoe ngoeino wihihupu la ma hohutulu yatingakika de ahao ai giama ma hagarara ari hononga gea wohiso sooika abe womou ai ngaukika ipaha deahawo o yesusu wabiruku ai giama ma hoatuku de ai kibiri gea wihialeme womou mou ai akirika,de o yesusu o nyawa manga ngoe ngoeino wihihupu la ma hohutulu yatingakika de ahao ai giama ma hagaraara arihononga gea wohiso soika abe womou ai ngaukika ipaha de ahao o yesusu waobiruku ai giama ma hoatuku de ai kibiri gea wihialeme womou mou ai akirika
01936,0,99,2,de ahao o yesus wotemoli onangika wato ka o kiali hohiketero abe ma jou wahi koano o nyawa eko o kiali duru itaana,de ahao o yesusu wotemoli onangika wato ka o kiali hohiketero abe ma jou wahikoano o nyawa eko o kiali duru itaana
01922,2,98,7,ma sara utu yoihene hoka o bibiti geea ipuraraha o tonaka ma rodaha iuku ona ge yodafongo ma jou ai demo demo agou goungu ho to ona manga wowango imaketero hoka yadatomoka o tonaka ma rodaha iuku ho de ma hasiloka,masara utu yoihene hoka o bibiti gea ipuraraha o tonaka ma rorahaiuku ona gea yodafongo ma jou ai demo demo agou goungu ho to ona manga wowango imaketero hoka yadatomoka o tonaka ma rorahaiuku ho de ma hasiloka
02427,0,98,4,de kiani ma jouika nimagahoko la ma kokangela gea koiboa uwahi abe ma oraha ma maata done duru nikangela niloara ma hoanika anga moi ma maata gea,de kiani ma jouika nimagahoko la ma kokangela gea ko iboauahi abe ma oraha ma maata done duru nikangela niloara ma hoanika angamoi ma maata gea
02433,4,97,35,hona ma tamatati nihingahuoka la ngini nihioriki abe ma dodunguu okia aha woidadi ma oraha o dunia ma bo baha itigioka ho nako ma dodungu gea koidadiuwahi ufa o nyawa inibudi la hi adono niataoko abe ma bo baha gea adonoka hona tinihitiari tato ngini kiani ka ihikaika nimagoana done inibudi ma titi o dunia ma bo baha em peyyunnn 08,ho naa mata mata tinihingahuoka la ngini nihioriki abe ma dodunguu o kia ahao idadi ma oraha o dunia ma bobaha itigioka ho nako ma dodunguu gea ko idadiuahi ufa o nyawa inibudi la hiadono niataoko abe ma bobaha gea adonoka ho naa tinihitiari tato ngini kiani ka ihikaika nimaagoana done inibudi ma titi o dunia ma bobaha
02152,6,0,28,o maruku pasalahiwo m een 08,9
02003,1,97,10,ne ma moiuku una wahokino o najangi moi de yahinoto iwitobaniiniiki wahokino la wahidingoto ona gea la yaho hinoto yoiki de wahidoaka ai kuaha onangika la kaidadi akokititoko o tokata ma dorou o nyawaino,de ma moiuku una wahokino ona yangimoi de yahinooto iwitobanii niiki wahokino la wahidingoto ona gea la yahohinooto yoiki de wahidoaka ai kuaha onangika la ka idadi akokititoko o tokata ma dorou o nyawaino
01857,6,0,31,maruku pasala hange ppepnnnn 08,3
02017,0,98,6,wotemo hokogea anga moi ma dihira una ma hirete abe wahuloko la o yohanese iwitaoko iwipakiti de iwibuika hohokonaa ma adeade abe hokokia o yohanese iwitoma ma dihira o herodese womagora to una ma sirete airiaka ngoi fekata de woilaka munangika de muna gee ami romanga o ngo herodiasa,wotemo hokogea angamoi ma dihira una ma hirete abe wahuloko la o yohanese iwitaoko iwipakiti de iwibuika ho hokonaa ma ade ade abe hokokia o yohanese iwitoma ma dihira o herodese womagora to una ma hirete ai riaka ngoi fekata de woilaka munangika de muna gea ami romanga o ngo herodiasa
02191,3,97,14,de wogogeruku de yaangimoi de yahinoto wa kokiahokino de wadotoko onangika bato o nagona dika ato yomahikurutie ma jou ai himangoka kiani ona gee a duru yomahitipokouku de o nyawa ma tamataika kiani yaleleani onangika de nako hokogea yomahitipokouku gee ahao ma jou wa etongo bato ona yokurutie,de wogogeruku de yangimoi de yahinooto wakokiahokino de wadotoko onangika wato onagona dika ato yomahikurutiye ma jou ai himangoka kiani ona gea duru yomahitipokouku de o nyawa mata mataika kiani yaleleani onangika de nako hokogea yomahitipokouku gea ahao ma jou waetongo wato ona yokurutiye
02185,3,97,14,de ipahade yosobo ato yohidotobiki o galilea ma tonakoka ma sara o yesusu ai mau watoduru wadotoko kayangi moi de yahinotoika dika hoioiki yomatohikoka la ato ufa o nyawa utu yahioriki,30 31 de ipaha de yosobo ato yohidotobiki o galilea ma tonakoka masara o yesusu ai mau wato duru wadotoko ka yangimoi de yahinootoika dika ho yoiki yomatohikoka la ato ufa o nyawa utu yahioriki
02615,0,99,5,abe ona ihingaku ngaku ona gee ahao o do dunguu irupa rupa tahidoaka onangika abe ona yakunu ihitito titoko o tokata ma dorou o nyawaino abe ma titi ahi romanga yafetongo de nagali abe ona ihingaku ngaku de yakunu yotemo temo o nyawa manga demo abe kotoonanguwa manga demo,abe ona ihingaku ngaku ona gea ahao o dodunguu irupa rupa tahidoaka onangika abe ona yakunu ihitito titoko o tokata ma dorou o nyawaino abe ma titi ahi romanga yafetongo de nagali abe ona ihingaku ngaku de yakunu yotemo temo o nyawa manga demo abe ko to onangua manga demo
01894,3,96,22,ho gee ma tamata o yesusu wahitiari o nangika anga moi naga o nyawa iwihiade ade ato una gee iwikitokata anga moi naga o womaha ma dorou unangoka em peyutnnn 08,ho gea mata mata o yesusu wahitiari onangika angamoi naga o nyawa iwihiade ade ato una gea iwikitokata angamoi naga o womaha ma dorou unangoka
01880,3,98,22,de womatengoli o yudasa skarioto una gea abe ahao wihidoaka o yesusu o nyawaika abe wihidee la iwitoma hokogea ona yangi moi de yahinoto manga roma romanga abe o yesusu waa iriki la yodadi ai hidingoto ma nyawa em ppneyuu 208,de womatengoli o yudasa isikarioto una gea abe ahao wihidoaka o yesusu o nyawaika abe iwihidee la iwitoma hokogea ona yangimoi de yahinooto manga roma romanga abe o yesusu wairiki la yodadi ai hidingoto ma nyawa
02601,0,98,9,de ngini na kiani niloikohi de niahingahu iwininikika de o petrusikao niwihingahu de niato o yesusu una gea wohiraka o galilea ma tonakika ho ahao niwihiduruika la ge enangoka de ahao nimakamakeoli de una anga moi una wohiraka abe imaketero hoka ma dihiraino winihibehehongoka,de ngini naa kiani niloikohi de niahingahu iwinii niikika de o peturusikaoo niwihingahu de niato o yesusu una gea wohiraka o galilea ma tonakika ho ahao niwihiduruika la genangoka de ahao nimakamakeoli de una angamoi una wohiraka abe imaketero hoka ma dihiraino winihibehehongoka
02330,6,0,47,ma ruku pasala ngimoi de hinoto emm pmennnuu 08,12
01953,2,98,13,de ge enangoka naga womatengo wikokitokata wogogere o arukoka abe o nyawa manga honenge ihingoha ngoha ma g enangika de komoiuwa kaidadi iwipakiti unangika la iwitumungu anga moi duru ma ngoeokau ai lou de ai giamo ka ma moi ihidapakiti de o rante,2 5 de genangoka naga womatengo iwikokitokata wogogere o arukoka abe o nyawa manga honenge ihingoha ngohama genangika de ko moiua ka idadi iwipakiti unangika la iwitumungu angamoi duru ma ngoeokau ai lou de ai giamoo ka ma moi ihidapakiti de o rante
01757,3,98,16,deto o yesusu aiabari ma do rahai imulaenge de o nyawa womatengo abe ai romanga o yohanese de una gee ma jou wihidingoto la ma oraha o yesusu kowoboauwahi de o yohanese kaidadi wohidiaiohi o yesusu ai ngekomo de gea idadi duru imaketero abehoka ma dihiraino ihitulihukuoka ma jou ai uru ma do dofanga ai bukuoka,2 3 de to yesusu ai abari ma rorahai imulaenge de o nyawa womatengo abe ai romanga o yohanese de una gea ma jou wihidingoto la ma oraha o yesusu ko woboauahi de o yohanese ka idadi wohidiaiohi o yesusu ai ngekomo de gea idadi duru imaketero abe hoka ma dihiraino ihitulihukuoka ma jou ai uru ma dodofanga ai bukuoka
01780,3,97,4,oka de waahoko de manga homa gea yanoaika de o yesusu iwinikoka,ho ka de wahoko de manga homa gea yanoaika de o yesusu iwiniikoka
01990,2,98,5,kade womihuloko de ma ngofeka gea momomikoka de kaidadi momadagi aika aino abe ma oraha gea ami ngumuru o tawongo ngiimoi de hinoto de ona gea o kamaroka duru yoheranga,ka de womihuloko de ma ngofeka gea momomikoka de ka idadi momadagi aika aino abe ma oraha gea ami ngumuru o taongo ngimoi de hinooto de ona gea o kamaroka duru yoheranga
01984,0,94,11,de gee o yesus woihene ma sara kowopusinguwa ma titi manga demo gea de kawitemo yairusika bato garoufa nohawana ma kiani nohingakuohi ngohino,de gea o yesusu woihene masara ko wopusingua ma titi manga demo gea de ka witemo o yairusika wato ngaro ufa nohawana ma kiani nohingakuohi ngohino
01794,0,98,5,de o tau ma goronaka gea naga o simono ngoi toroa momaiduoka anga moi imigogama oka de wowohama de iwihingahu o yesusika ma tiiti muna gee ami kangela,de o tau ma goronaka gea naga o simono ngoi toroa momaiduoka angamoi imigogama ho ka de wowohama de iwihingahu o yesusika ma titi muna gea ami kangela
01782,3,97,25,de nagaali ge enangoka manga baba de o nyawa yamuruono naga abe yahikarajaanga la yomakuduhunu manga karajaangoka de o ria dodoto gea ona ngo o yesusu waahoko la iwitobaniiki hogea manga baba o zebedeusu de manga dodiawo yaakokinoaika manga ngotiroka de ona ngo o yesusu ibiniikoka em peyutn 08,de nagali genangoka manga baba de o nyawa yamuruono naga abe yahikarajaanga la yomakuduhunu manga karajaangoka de o ria dodoto gea onangoo o yesusu wahoko la iwitobaniiki ho gea manga baba o sebedeusu de manga dodiawo yakokinoaika manga ngotiroka de onangoo o yesusu iwiniikoka
01796,0,98,5,de ahao ka de ihohomuku de naga o nyawa manga ngoe yoboaino yesusino de yaakokiaoino o nyawa mata mata abe yaakokitokata de abe yopo panyakeuku,de ahao ka de ihohomuku de naga o nyawa manga ngoe yoboaino o yesusino de yakokiaoino o nyawa mata mata abe yakokitokata de abe yopopanyakeuku
01986,3,99,4,de yogila gila de yomahiadono o yairusu ai tauika de ge enangoka naga o nyawa manga ngoe de woihene manga gigoro abe o hagaga de o garino de gea manga gari kohaamokie,de yogila gila de yomahiadono o yairusu ai tauika de genangoka naga o nyawa manga ngoe de woihene manga gigoro abe o hagaaga de o garino de gea manga gari kohaamokiye
01951,3,97,19,ho ipahaino de o yesusu de ona iwiniiniiki yomahiadonoka o akere ma ngooto ma honongaika abe o gerasa ma nyawa yogogere ge enangoka de youti ge enangiha empeyuutnn 08,ho ipahaino de o yesusu de ona iwinii niiki yomahiadonoka o akere ma ngooto ma honongaika abe o gerasa ma nyawa yogogere genangoka de youti genangiha
01755,5,96,29,ho kona imulaenge ma adeade abe hohiromanga o abari ma ro rahai de o habari na ihitiiti o yesus kristusu ai wowangoino abe una gee ma jou ai ngofaka de to ngone nanga koano abe ma do diherainohi ma jou wonahibehongoka ngoneino emppnnuyunnn 08,hokonaa imulaenge ma ade ade abe hohiromanga o abari ma rorahai de o abari naa ihititi o yesusu kristusu ai wowangoino abe una gea ma jou ai ngofaka de to ngone nanga koano abe ma dodihirainohi ma jou wonahibehehongoka ngoneino
02332,0,97,8,wodato mo ibooto de wohikilolitino wadaduhu ma redi gea wadaduhu ibooto de ahao wafaiti o humu moi abe o anggur ma teongo ahao ihahuru ge e nanguku de aho moi wodiai abe o redi yogoa goana manga tau,wodatomo ibooto de wohigilolitino wadaduhu ma redi gea wadaduhu ibooto de ahao wofaiti o humu moi abe o angguru ma teongo ahao ihahuru genanguku de ahao moi wodiai abe o redi yogoa goana manga tau
01769,0,97,7,de ma oraha gea o yesusu naga o galilea ma tonakoka abe o kapongo moi ma romanga o nazarete hoge enangoka de waino woboa o yohanesino de o yohanese wiohiki o yesusu ge enangoka o jorodani ma akeruku,de ma oraha gea o yesusu naga o galilea ma tonakoka abe o kapongo moi ma romanga o nasarete ho genangoka de waino woboa o yohanesino de o yohanese wiohiki o yesusu genangoka o yorodani ma akeruku
01979,0,97,5,de ona iwiniiniiki o yesusu ai demo apaluhu ato abei ka ona yomahiefotika ngonaika manga ngoe de gee noleha ngona nato ona gona ihisoo ngohino,de ona iwinii niiki o yesusu ai demo apaluhu ato abeika ona yomahiefotika ngonaika manga ngoe de gea noleha ngona nato onagona ihiso ngohino
01896,0,98,4,ho ipaha deahao o yesusu ngoi meme de ai do dodoto yoboaino ona doka o tau ma poretoka dika de iwibehehongo la ato una wohupuohi de watu tumohi ngoi meme de ai do dodoto gea,ho ipaha de ahao o yesusu ngoi meme de ai doo dodoto yoboaino ona doka o tau ma poretoka dika de iwibehehongo la ato una wohupuohi de watutumohi ngoi meme de ai doo dodoto gea
01882,3,98,11,holokuoka de yauku youtiuku de yolio yowohamika ma tau ma goronaika ma sara imaketero hoka ma dihirali naga o nyawa ko manga ngoe iwiniiki de genangoka yomatomuino o tau ma goronaka ho o yesusu de winii niiki ato yolomo ma koidadiuwa anga moi o nyawa yowoe holi,ho o lokuoka de auku youtiuku de yolio yowohamika ma tau ma goronaika masara imaketero hoka ma dihirali naga o nyawa ko manga ngoe iwiniiki de genangoka yomatoomuino o tau ma goronaka ho o yesusu de iwinii niiki ato yolomo ma ko idadiua angamoi o nyawa yowoeholi
02193,0,99,5,ho una wato ona gonadika nginioka abe ma titi nihiniiki ngohi de hiadono o nyawa niadafongo ngaro o nyawa gea kayotipokouku dika hoka o kokawaha dika ma sara gea imaketero abe hoka ngini nihidafongoka ngohi,ho una wato onagona dika nginioka abe ma titi nihiniiki ngohi de hiadono o nyawa niadafongo ngaro o nyawa gea ka yotipokouku dika hoka o kokawaaha dika masara gea imaketero abe hoka ngini nihidafongoka ngohi
02187,5,94,28,ma sara yaangi moi de yahinoto gee ai demo ko ataokuwa de koyomoroinuwa iwileha ai demo ma titi em pepeyuyutunn 08,masara yangimoi de yahinooto gea ai demo ko yataokua de ko yomoroinua iwileha ai demo ma titi
02015,2,98,10,ma sara utu yafikifikiri ma titi o yesusu de ona yotemo ato bote una gee o elia abe ma jou ai uru ma do dofanga ma do dihiraino de utuoli naga yotemo ato kouwa ma una gee ma jou ai uru ma do dofanga womatengoli abe ma jou wihidingoto ngoneino naa abehoka ma dodihiraka naga ai uru ma do dofanga manga ngoe,masara utu yafiki fikiri ma titi o yesusu de ona yotemo ato bote una gea o elia abe ma jou ai uru ma dodofanga ma dodihiraino de utuoli naga yotemo ato koua ma una gea ma jou ai uru ma dodofanga womatengoli abe ma jou wihidingoto ngoneino naa abe hoka ma dodihiraka naga ai uru ma dodofanga manga ngoe
02178,2,98,7,kade wotemo ibooto de ai baba wopoaka bato ahi baluhu ahi ngo ngaku naga ma sara kaikurangohi ho ngohi tomagahoko la nohiduhunu la ahi ngo ngaku kaidogo iputurungu,ka de wotemo ibooto de ai baba wopoaka wato ahi baluhu ahi ngongaku naga masara ka ikurangohi ho ngohi tomagahoko la nohiduhunu la ahi ngongaku ka idogo iputurungu
01869,2,96,12,ma sara anga moi ona duru ko manga ngoe ho yomahiduutukino o yesusino hogea hiadono wahuloko wininikika bato o ngotirini hihidiai la kalioli ihi hideefotino,masara angamoi ona duru ko manga ngoe ho yomahidutukino o yesusino ho gea hiadono wahuloko iwinii niikika wato o ngotiri nihihidiai la kalioli ihihideefotino
02029,0,99,1,de gea womataiti wihuloko o tentara womatengo wato to una ai pea nalee de naoino ngohino de o tentara gea wosobo de woiki o bui ma tauika de o yohanese ai tomarino watobiki,de gea womataiti wihuloko o tentara womatengo wato to una ai pea nale de naoino ngohino de o tentara gea wosobo de woiki o bui ma tauika de o yohanese ai tomarino watobiki
01908,3,96,6,de utu gee ipuraraha o hihikauku de imahidawango ka ma moi de ma hihika ho o hihika gee a ade horoka enangika hiadono koiihofokuwa,de utu gea ipuraraha o hihikauku de imahidawango ka ma moi de ma hihika ho o hihika gea adehoroka enangika hiadono ko ihofokua
02425,0,99,4,de ngini utu nako nia redioka ufa nilio de niato ahi baju ma do dururudika toleohi ma sara ngini kiani nikokiloaroka la ufa hiadono o kokangela inihidotadaene,de ngini utu nako nia redioka ufa nilio de niato ahi baju ma doduruuru dika toleohi masara ngini kiani nikokiloaroka la ufa hiadono o kokangela inihidotadaene
02431,3,97,12,anga moi naga manga ngoe aha yoboaino de yomahiromanga ato ngohinaa ma koano abe ma jou winihibehehongoka e koutua ato ngohinaa ma jou ai uru ma do dofanga ma sara ona gea yotobabudi dika hok yagou gounguwa,angamoi naga manga ngoe ahao yoboaino de yomahiromanga ato ngohi naa ma koano abe ma jou winihibehehongoka eko utu ato ngohi naa ma jou ai uru ma dodofanga masara ona gea yotobabudi dika ko yagou goungua
